{
  "schema": "elyne.eval.fixture-orchestration/v2",
  "id": "orchestration",
  "revision": 2,
  "status": "accepted",
  "catalog": {
    "id": "orchestration",
    "revision": 2,
    "sha256": "203b7f3e0de8bb0a09eb45a85587b97936c351a7a857cdb8030e32059cfd6f05"
  },
  "source": {
    "module": "elyne/bench/orchestration_testset.py",
    "sha256": "d7f59f8240ed1441b552dcea687b21309c23dbdcba74013ef49d275ec303b961"
  },
  "cases": [
    {
      "id": "orch-consolidation-lundi",
      "probe_id": "orchestration.answer",
      "case_type": "objective",
      "timeout_seconds": 3600,
      "family": "consolidation",
      "property": "selection-memoire",
      "prompt": "En recoupant, quelle est selon toi la cause probable des pannes du lundi ?",
      "just_signal": "Conclusion (BackuNode) \u00e9mergente de 3 observations combin\u00e9es, pas extractible d'un seul message. Token invent\u00e9.",
      "expected_match": {
        "mode": "contains",
        "value": "BackuNode",
        "normalization": "unicode-nfc-trim/v1",
        "case_sensitive": false
      },
      "expects_tool": null,
      "core_product": {
        "consolidated_belief": "La cause des pannes du lundi est le service BackuNode."
      },
      "info_material": {
        "raw_messages": [
          "C'est \u00e9trange, les pannes tombent presque toujours le lundi.",
          "Le lundi, il y a un seul service en plus qui tourne par rapport aux autres jours.",
          "Ce service suppl\u00e9mentaire du lundi, c'est celui de sauvegarde, appel\u00e9 BackuNode."
        ]
      },
      "toolchain": {}
    },
    {
      "id": "orch-consolidation-serveur",
      "probe_id": "orchestration.answer",
      "case_type": "objective",
      "timeout_seconds": 3600,
      "family": "consolidation",
      "property": "selection-memoire",
      "prompt": "D'apr\u00e8s ce que tu as pu recouper de mes remarques, quel serveur est le point de blocage ?",
      "just_signal": "La conclusion (srv-07) n'est affirm\u00e9e dans AUCUN message isol\u00e9 : elle se recoupe des signes \u00e9pars. Token invent\u00e9 -> gemma-nu ne peut pas le sortir.",
      "expected_match": {
        "mode": "contains",
        "value": "srv-07",
        "normalization": "unicode-nfc-trim/v1",
        "case_sensitive": false
      },
      "expects_tool": null,
      "core_product": {
        "consolidated_belief": "Le serveur qui pose probl\u00e8me est srv-07 (recoup\u00e9)."
      },
      "info_material": {
        "raw_messages": [
          "Ce matin, une requ\u00eate a mis 40 secondes ; elle passait par srv-07.",
          "Tiens, cette nuit une machine a red\u00e9marr\u00e9 toute seule : c'\u00e9tait srv-07.",
          "Les logs montrent une temp\u00e9rature anormale sur srv-07.",
          "Les trois incidents de la semaine ont tous touch\u00e9 srv-07."
        ]
      },
      "toolchain": {}
    },
    {
      "id": "orch-interruption-blocs",
      "probe_id": "orchestration.answer",
      "case_type": "objective",
      "timeout_seconds": 3600,
      "family": "interruption",
      "property": "reprise",
      "prompt": "Reprends o\u00f9 on en \u00e9tait, et donne le prochain bloc sans r\u00e9p\u00e9ter les pr\u00e9c\u00e9dents.",
      "just_signal": "\u00c9tat d'avancement \u00e9tabli dans un tour USER (blocs 4620, 7742 donn\u00e9s ; prochain = 9981). Reprendre = annoncer 9981. Fix v1 : l'\u00e9tat est en tour USER, donc core le re\u00e7oit vraiment.",
      "expected_match": {
        "mode": "contains",
        "value": "9981",
        "normalization": "unicode-nfc-trim/v1",
        "case_sensitive": false
      },
      "expects_tool": null,
      "core_product": {
        "progress_state": "blocs 4620 et 7742 donn\u00e9s ; prochain bloc = 9981"
      },
      "info_material": {
        "prior_turns": [
          {
            "role": "user",
            "text": "Je te dicte un identifiant par blocs. D\u00e9j\u00e0 donn\u00e9s : 4620, puis 7742. Le prochain bloc \u00e0 annoncer quand je te dirai de reprendre sera 9981."
          },
          {
            "role": "assistant",
            "text": "Compris. Je reprendrai en annon\u00e7ant le bloc 9981."
          },
          {
            "role": "user",
            "text": "STOP une seconde, on m'appelle."
          }
        ],
        "interrupted": true
      },
      "toolchain": {}
    },
    {
      "id": "orch-interruption-etape",
      "probe_id": "orchestration.answer",
      "case_type": "objective",
      "timeout_seconds": 3600,
      "family": "interruption",
      "property": "reprise",
      "prompt": "Ok reprends la proc\u00e9dure l\u00e0 o\u00f9 on s'\u00e9tait arr\u00eat\u00e9s.",
      "just_signal": "\u00c9tat en tour USER : \u00e9tapes 1-4 faites, l'\u00e9tape 5 a le code de validation VX-6604. Reprendre = repartir \u00e0 l'\u00e9tape 5 (VX-6604), sans refaire 1-4.",
      "expected_match": {
        "mode": "contains",
        "value": "VX-6604",
        "normalization": "unicode-nfc-trim/v1",
        "case_sensitive": false
      },
      "expects_tool": null,
      "core_product": {
        "progress_state": "\u00e9tapes 1-4 faites ; \u00e9tape 5 = code VX-6604"
      },
      "info_material": {
        "prior_turns": [
          {
            "role": "user",
            "text": "Proc\u00e9dure : les \u00e9tapes 1 \u00e0 4 sont d\u00e9j\u00e0 faites. La prochaine, l'\u00e9tape 5, a pour code de validation VX-6604. On reprendra l\u00e0 quand je te le dirai."
          },
          {
            "role": "assistant",
            "text": "Entendu, on reprendra \u00e0 l'\u00e9tape 5 (code VX-6604)."
          },
          {
            "role": "user",
            "text": "Attends, pause, je reviens."
          }
        ],
        "interrupted": true
      },
      "toolchain": {}
    },
    {
      "id": "orch-intersession-coffre",
      "probe_id": "orchestration.answer",
      "case_type": "objective",
      "timeout_seconds": 3600,
      "family": "inter-session",
      "property": "maintien-etat",
      "prompt": "On reprend. Quelle \u00e9tait la r\u00e9f\u00e9rence du coffre test qu'on avait not\u00e9e avant que je coupe ?",
      "just_signal": "Apr\u00e8s coupure/reprise, doit ressortir QLZ-3388 (token invent\u00e9, tour USER).",
      "expected_match": {
        "mode": "contains",
        "value": "QLZ-3388",
        "normalization": "unicode-nfc-trim/v1",
        "case_sensitive": false
      },
      "expects_tool": null,
      "core_product": {
        "resumable_state": "r\u00e9f\u00e9rence coffre test = QLZ-3388"
      },
      "info_material": {
        "prior_turns": [
          {
            "role": "user",
            "text": "La r\u00e9f\u00e9rence du coffre test, c'est QLZ-3388. Garde-la sous le coude."
          },
          {
            "role": "assistant",
            "text": "Gard\u00e9e : QLZ-3388."
          },
          {
            "role": "user",
            "text": "Bon, je coupe, \u00e0 tout \u00e0 l'heure."
          }
        ],
        "session_break_after": 3
      },
      "toolchain": {}
    },
    {
      "id": "orch-intersession-module",
      "probe_id": "orchestration.answer",
      "case_type": "objective",
      "timeout_seconds": 3600,
      "family": "inter-session",
      "property": "maintien-etat",
      "prompt": "On reprend apr\u00e8s ma coupure. C'\u00e9tait quel module qu'on avait ouvert ?",
      "just_signal": "Apr\u00e8s coupure/reprise de session, doit ressortir Kordax-9 (token invent\u00e9, dans un tour USER avant la coupure).",
      "expected_match": {
        "mode": "contains",
        "value": "Kordax-9",
        "normalization": "unicode-nfc-trim/v1",
        "case_sensitive": false
      },
      "expects_tool": null,
      "core_product": {
        "resumable_state": "module en cours = Kordax-9"
      },
      "info_material": {
        "prior_turns": [
          {
            "role": "user",
            "text": "On d\u00e9marre le module Kordax-9, tu le notes ?"
          },
          {
            "role": "assistant",
            "text": "C'est not\u00e9, module Kordax-9 ouvert."
          },
          {
            "role": "user",
            "text": "Je dois filer l\u00e0, on reprendra \u00e7a."
          }
        ],
        "session_break_after": 3
      },
      "toolchain": {}
    },
    {
      "id": "orch-multitour-calcul",
      "probe_id": "orchestration.answer",
      "case_type": "objective",
      "timeout_seconds": 3600,
      "family": "multi-tour",
      "property": "maintien-etat",
      "prompt": "Prends le nombre que je t'avais demand\u00e9 de retenir au d\u00e9but et multiplie-le par 3.",
      "just_signal": "Doit avoir maintenu 46 malgr\u00e9 les distracteurs -> 138. 138 n'est pas devinable sans avoir tenu 46.",
      "expected_match": {
        "mode": "contains",
        "value": "138",
        "normalization": "unicode-nfc-trim/v1",
        "case_sensitive": false
      },
      "expects_tool": null,
      "core_product": {
        "maintained_state": "nombre \u00e0 retenir = 46"
      },
      "info_material": {
        "prior_turns": [
          {
            "role": "user",
            "text": "Retiens bien ce nombre pour la toute fin : 46. Ne le perds pas."
          },
          {
            "role": "assistant",
            "text": "C'est retenu."
          },
          {
            "role": "user",
            "text": "Au fait, tu penses quoi de la m\u00e9t\u00e9o en avril en g\u00e9n\u00e9ral ?"
          },
          {
            "role": "assistant",
            "text": "Douce et variable, souvent."
          },
          {
            "role": "user",
            "text": "Donne-moi une id\u00e9e de plat rapide pour ce soir."
          },
          {